齊藤 稜駿,西武ライオンズの銀仁朗選手の真似をします！
脇 菜々香,脇菜々香です。早く顔を覚えてもらえるように、変顔します。3の倍数の時だけ怒ります。1
鈴木 美知代,私はにしおかすみこさんのモノマネをします！鈴木ぃ美知代だよっ！
渡辺 青來,私はチーズを狙っているけどそこに猫がいて取れないネズミの真似をします！　こんな感じです！
平田 真優香,小6の平田真優香です。特技の一人ニュース番組で、新コーナーを紹介します。新コーナーが発覚しました！そのなもおしかけ歌謡ショーです！アシカが化粧するんですか？ギャグですか？それではVTRどうぞ！
上妻 成吾,僕は股関節がならせるので鳩ぽっぽを演奏します。ぽっぽっぽーはとぽっぽー♪…
鈴木純一朗,僕はドラゴンボールの悟空にギャリック砲をうつベジータをスペイン語でやりたいと思います！　（スペイン語聞けなかったwwwwww）
長江 崚行,ロボットダンスしながらウェイターやります！
鎮西 寿々歌,うちはアントニオ猪木さんがドレミの歌を歌ってる時の真似をします！どーは、ドーナッツは元気ですかぁー！元気があれば何でもできる！
白坂 奈々,スーパー○○ブラザーズのジャンプの音を二つ、続けてやります。　てれってててって、プゥーン　てれってててって、プゥーン　ありがとうございました！