2015年3月13日(金),私の好きなニッポン［原田明莉］,投稿者:原田明莉 | 投稿時間:19時20分 | カテゴリ：てれび戦士 | 固定リンク

★Hello★

あかりですー！

 

原田のほうです！

 

このあいだ、とてつもなくビックリしたことがおきました！！！

 

そのこととは…

飯島ちゃんが前髪をきったことです！
[画像：飯島緋梨、原田明莉]
緋梨ちゃんが明莉と同じくらいの前髪のながさ！

 

 

それにしても『 【 緋梨（あかり）ちゃん 】 が 【 明莉（あかり） 】 と ～』って聞きづらい

 

 

いつも2人で話してるときは、緋梨ちゃんと呼ぶときもあるので、

 

あかり、あかり、あかり…

 

もぅ、話しづらっ　って、なるんですよ！！！

 

 

いやー、

それにしても似合うー♪かわいー♪♪

 

と、思いきや、

きってませーーーん！！！

 

 

その前に、

緋梨ちゃんが『 緋梨、美容院行くんだー！』と言っていたもんで…

本気でだまされちゃいました\(//∇//)\

 

 

 

それでは、本題に入ります！

 

今回のお題は…

☆私の好きなニッポン☆です！！！

 

エエットデスネェ、

ワタシ ノ スキナ ニッポン トハ（笑）

 

3つあります！

 

 

まず、

 

学校に行けて、ご飯を食べられて、

本当に当たり前のことができるって、本当に幸せです！

 

この日本にうまれて、本当に幸せです！

 

 

 

次に格闘技が盛んなこと！！！

 

わたし、空手以外にもいろんな格闘技が大好きなんですよ！

 

日本にいるからこそ、いろんな格闘技をみることができます！！！

 

 

 

そしてそして、3つ目は…

食べ物がおいしーーーーーーーことです！！！

 

その中でも、

やっぱりやっぱり

 

日本といえばぁぁぁぁーーー

お寿司ーーーーーーーーーーー！
[画像：原田明莉]

お寿司って、本当においしいです！

文章を書いてたら、食べたくなって食べちゃいましたー♪

 

これからも、日本大好き！！！