2016年8月12日 (金),私の大発見！［桐畑カレン］,投稿者:桐畑カレン | 投稿時間:18時45分 | カテゴリ：てれび戦士 | 固定リンク

こんにちは。
カレンです (*^^*)
 
今年も行ってきました。
霞ヶ関子ども見学デー (^^)/

［画像：桐畑カレン］

わくわく o(*ﾟ∀ﾟ*)o
今年行ったのは去年まわれなかったところです。
 
そこで興味をひかれたのが財務省のこれ！
『 １億円の重さ 』
１億円 (°Д°)
０が何個？
100000000
８個もつくー (○_○)
チャリチャリチャリーン。
あ、でもお札だからパサパサパサかなー。
などと考えながら、１億円を持ってみました。
紙だからあまり重くないのかな？
と思いながら持ってみたら、
ズーン w(゜o゜)w
重い・・・重すぎる・・・でもがんばる！
フンガー (‘＊‘)
力を入れて持ってみたら、持てました(^-^)v
だいたい１億円の重さは10キロだそうです。
２リットルのペットボトル５本分ですね。
☆ １億円の重さ大発見 ☆

［画像：桐畑カレン］

続きまして、もう１つ。
夏休みに旅行したときにみつけた大発見をご紹介。
飛行機が離陸してどんどん空に向かって飛んでいくときに、
『 耳がポワーン 』
てなりませんか？
この耳ポワーン現象、苦手です (. .)
なぜかこのとき、
本当にたまたま、
音楽を聞こうと思ってだしてあったイヤホンを、
離陸する前に耳にすっぽりはめてみたんです。( イヤホンは無音で )
そしたら、耳ポワーン現象にならなかったんです！
帰りも試してみました。
やっぱり、耳ポワーン現象にならなかったんです！
えー！？すごい！！
なぜか分からないけどすごい！！
☆ 耳ポワーン現象がおこりそうな予感があるときは、耳にイヤホン大発見 ☆
ぜひお試しください(*^▽^)/★*☆

［画像：桐畑カレン］
