2013年08月07日 (水),【わたしのペット】黒澤美澪奈,投稿者:黒澤美澪奈 | 投稿時間:18時00分 | カテゴリ：We are 大天才テレビジョン | 固定リンク

★わたしのペット★
こんにちは！
みれなです(^o^)v
 
ペットですか…
私は、今、ペットは飼っないんです
残念です(T_T)
 
でも！いつか…いつかはっ！
飼ってみたいペットがいます
 
それは、イルカです(o>ω<o)
↑
(果たして、現実的に飼えるのかどうか？それは分かりません笑)
 
私が幼稚園生の頃、『イルカにふれ合おう！』というイベントに、遊びに行ったことがあります！
 
海の中を仕切ってある大きなプールみたいなところに、きれいな魚が泳いでいて、そこにイルカがいたのです！
そこで一緒に泳いだり、餌をあげたり出来たのですが、そのイルカ達がお利口さんで、とても可愛いかったんです♪
 
あと、不思議なことがあって、イルカの泳いでいるその海の中には、とてもたくさんの色とりどりの小さな魚がいて、イルカにくっついて泳いでいるのです。
どうしてかな？
イルカに食べられちゃわないのかな？
と、ジーーーーーッと見ていたら
なんと！
 
 
イルカが、その小さな魚達に餌をあげてるんです！
私があげたイルカ用の餌の切り身を、イルカは口の中に一度入れて、小さくかみ砕いてから吐き出して、周りの小さな魚達にあげてるんですよ～
 
あのときは、感動したな～(T▽T) 
 
そんな優しくて賢い～イルカを飼ってみたいです♪

［画像：黒澤美澪奈、イルカ］
 
この写真は、その時のです！
特に、このイルカはとてもいい子でした(^o^)
 
★最近、はじめて知りました★
 
皆さん！うなぎは好きですか？
 
よく、うなぎの骨が刺さった～！！！
って言いますよね？
 
でも、私は一度も刺さったことがなかったんです！
 
刺さって慌てた人を見ても、他人事のように思っていて、
ホントに骨なんてあるの？って思っていたら…
 
まさかのまさか！
先日食べた時、うなぎの骨が喉に刺さってしまいました…
ガーン  (￣ロ￣lll)
 
うなぎに骨ありました
結構、痛いものですね…
 
でも、しばらくしたら自然にとれてすっきり！
みなさんも、おいしいものを食べる時は、気をつけてくださいね～笑