2016年9月23日 (金),○○県の思い出［飯島緋梨］,投稿者:飯島緋梨 | 投稿時間:18時45分 | カテゴリ：てれび戦士 | 固定リンク

こんにちは
飯島緋梨です！
 
あっという間に夏休みが終わって
だんだん風が涼しくなってきて、
そろそろ秋になりますね。
秋にはおいしい食べものがいっぱい*\(^o^)/*
よーし！楽しみだぞ～！
 
さてさて！
今回のお題は
｢ 北海道での思い出 ｣です！！

私が北海道に行ったのは今から約２年前！
北海道どちゃもん、るるを探しに行きました。
広大な北海道の畑で収穫のお手伝いをさせてもらって
地元の人たちがすごく優しくしてくれて、
本当にお世話になりました (^^)
あんなに広い畑を見たのは初めてで、
すごく驚いたのを今でも覚えています (笑)
 
その後、農業高校で収穫した野菜を使って、
るるのために手作りピザを作って
るるに食べてもらいました (⌒▽⌒)
ピザは採りたての野菜が優しい味でおいしくて、
今まで食べたことのないピザでした
また食べたいな！！
 
博物館にも行きました。
とっても寒い体験ができるところがあって、
白熊ちゃんもいて北極にいるみたいな気分になりました。
北海道の名物“ カニ ”のオブジェも見に行きましたよ！
思い出すと楽しいことがいっぱいあったな～♪
次はみんなでまた行きたいなー！

[画像：飯島緋梨、笹原尚季]

皆さんにも心に残っている景色や、
行ってみたい場所はありますか？？
Let's 〇〇県の思い出！