2013年08月09日 (金),【わたしのペット】中里萌,投稿者:中里萌 | 投稿時間:18時00分 | カテゴリ：We are 大天才テレビジョン | 固定リンク

★わたしのペット★
 
わたしのペットは…
 
去年の夏からいるハムスターと、最近わが家に来たばかりのトイプードルです。
 
 
ハムスターはなぜか？私の手ばかりかみます。
 
私だけ嫌われているのでしょうか(｡-_-｡)

［画像：ハムスター］
 
 
そして、トイプードルは２年前から心の底からほしくてほしくて
やっとの思いでわが家に来ました。

［画像：中里萌、トイプードル］

うれしすぎて、ヒマがあれば遊んだり・遊んだり・遊んだり…しています(?≧?≦)
 
めちゃめちゃ、かわいすぎる私のペットたちでーす。
 
 
★最近、はじめて知りました★
 
この歳にして始めて知ったことは…
 
 
グラスの持ち方です。
 
 
お笑い芸人のひげだんしゃくさんの持ち方を見ると、そのような持ち方が印象強くて
 
 
家で子供シャンパンを飲むのにその持ち方をしていたら
 
 
お父さんとお母さんに笑われてしまいました。
 
 
大人になる前に、気がついて良かったです(⌒▽⌒)