2014年02月21日 (金),【冬イベントの思い出】延命杏咲実,投稿者:延命杏咲実 | 投稿時間:18時00分 | カテゴリ：We are 大天才テレビジョン | 固定リンク

★冬イベントの思い出★

かぜが、すっかり治った延命です。

冬イベは、かぜで始まり、かぜで終わりました・・・

最初の読み合わせの時も、声がガラガラでした。

最後の本番も、声がガラガラでした・・・

でも、それも思い出になると思います！

本番は大変でしたが(笑)

みなさんも、かぜには気を付けてくださいね！

［画像：黒澤美澪奈、延命杏咲実、山田陶子］
 
★小説：「大！天才てれびくん」★

てれび戦士と、ボスと、あきえさんの15人で全国をまわる旅に出かけました。

今は、もう日本から旅立ち、飛行機に乗って、中国へ行きます。

「中か料理楽しみだね～！」
「パンダ見たいね～！」

など、いろんな声が聞こえてきます。

でも、てれび戦士たち15人だけはちがいます。
バックをあさって、あさりまくっていました。

「ない！」「ない！」「な～い！」

なんと15人全員が、さいふを家にわすれてしまったのです。

でも、全員、さいふをわすれてしまったので、おかしくて、
とうとうふき出して笑ってしまいました。

というフィクションでした～☆

この物語には、ピンチの時も笑っていたいな、という気持ちがこめられています！

何でも笑いが一番です！