2013年10月24日 (木),【読書の秋２０１３】竹原司,投稿者:竹原司 | 投稿時間:18時00分 | カテゴリ：We are 大天才テレビジョン | 固定リンク

★読書の秋２０１３★
こんにちは！司です。

ぼくが最近読んだ本で、おもしろかった本は「終わりのセラフ」という本です。
「終わりのセラフ」は、マンガで、その小説版が、この本です。

この本のストーリーは、世界が滅亡し、
地上が吸血鬼に支配される直前の最後の春に、
主人公の一瀬グレン１５才が入学した呪術師学校で、胸に大きな野心を抱きながらも、
弱いと嘲られながら過ごすなかで起きる戦争や事件で、
主人公はどうするかという本です。

おもしろいので、ぜひ読んでみてください。


［画像：竹原司］
 
★倍返ししたいこと★
この前、学校で５０ｍのタイムをはかったとき

ぼくは足がおそいので、友達に「おそいね！」と笑われた時に「倍返しだ！」と言って、

その後あった、ぜんくつの長さをはかるしゅもくで、ぼくは体がやわらかいから、

男子の中で一番になって、おそいと言った友達に
「倍返し成功！」とドヤ顔で言ったら「くっそ～」とくやしがっていました。

倍返し成功した司でした！
 