2015年9月14日(月),〇〇の秋［桐畑カレン］,投稿者:桐畑カレン | 投稿時間:18時45分 | カテゴリ：てれび戦士 | 固定リンク

こんにちは。
カレンです (*^^*)
<br> 
秋といえば、私の中では食欲の秋！
うーん、食欲は１年中かも(^-^;
私のおたんじょう日があったり～
お月さまがきれいに見えたり～
やっぱり秋は好きな季節です♪
[画像：桐畑カレン]
<br>
今年の秋は、ずばり！
☆ 自転車に乗れる秋 ☆
にしたいです。
「 乗れたらいいな～ 」
くらいに思っていた自転車。でも最近・・・
自転車に乗れない (--;)
なんか不便・・・(^^;)
と思うようになってきて、今は乗りたい！という強い気持ちが出てきました。
運動が苦手な私だけど、強化訓練で、
「 おおなわとび 」や「 とび箱 」の練習をさせてもらって、ちょっと自信がついたんです。
「 あれっ、私、なんかできるかも～ 」って (^^)
人より時間はかかるけど (^-^;
ようち園のころに買ってもらった自転車。
乗れなくて、練習がいやであきらめてしまって、
おばあちゃんのおうちにねむったままです。
今度こそはあきらめずに練習！練習！練習！
そして、乗れるようになったら、
秋の気持ちいい日にサイクリングに出かけたいな♪
<br> 
<br> 
女の子だから
☆　おしゃれの秋　☆
も気になります。
この前ね、だーはらちゃんに「 腹筋運動の仕方 」を教えてもらったんですよ。
それで本当の腹筋らしい腹筋が
少しずつできるようになってきている気がしているんですよ。たぶん (^^;))
いろんなおしゃれができるように
食欲でぽっこりしたおなかをひきしめたいなと思います (*^o^)
[画像：桐畑カレン 原田明莉]