2016年1月21日(木),お気に入りの食べもの［飯島緋梨］,投稿者:飯島緋梨 | 投稿時間:18時54分 | カテゴリ：てれび戦士 | 固定リンク

こんにちは！
飯島緋梨です ^o^
<br> 
みなさんは冬休み楽しみましたか～？
緋梨は学校のお友達といっぱい遊びました！
アイススケートをしたり
お買いものしたり
デザートバイキングに行ったり・・・
とっても楽しかったです (*^o^*)
<br>
ではでは！
今回のお題は・・・「 お気に入りの食べもの 」
緋梨の好きな食べ物は～
いろいろあるけど好きな食べものは・・・？
お正月には、お正月らしい
おせち・お雑煮・おもちといろいろ食べたけど、
そろそろあきたな～と思っていたら、
お母さんに今日は何が食べたい？と聞かれました。
う～ん何にしょう？
焼肉？ カレー？ スパゲッティ？
迷ったけど【 チヂミ 】にしました！！
[画像：飯島緋梨]
うちのチヂミには
にら・ニンジン・エノキ・山芋・エビ・イカが入っていて
カリッとトロッとしていてゴマ油がきいてていて
超おいしい♪───Ｏ（≧∇≦）Ｏ────♪
<br> 
そしてもう１つが・・・
【 ピーマン 】です！！
蝶野教官の強化訓練で、
ピーマン農家の原さんのところへ行って、
ピーマンを収穫したり
ピーマン料理を作ったり食べたりして、
苦手だったピーマンが食べられるようになりました！
あれから・・・
いつものご飯のメニューにもピーマン料理が出てくるように (^^)
あの独特な苦味とシャキシャキとした歯ごたえが苦手だったのに
今では好きかも？になりました！
[画像：飯島緋梨]
みなさんにも苦手な食べものはあると思いますが、
でもでも、お母さんと一緒に苦手な食べものの料理を作ってみてください！
自分で作った料理は一口でも食べてみれば、きっと好きになるはずです！！
ぜひ挑戦してみてくださいね (^o^)