2016年5月23日 (月),なくてはならないモノ［桐畑カレン］,投稿者:桐畑カレン | 投稿時間:18時45分 | カテゴリ：てれび戦士 | 固定リンク

こんにちは。

カレンです(*^^*)

 

暑い！と思う日が増えてきましたね～。

最近はお友だちと水風船を使った鬼ごっこなどをして遊んでいます。

とーっても楽しいです♪

水がバシャーってかかっても、あっという間にかわいちゃう季節が待ちどおしいな。

 

＊.｡.:*・ﾟ ＊.｡.:*・ﾟ ＊.｡.:*・＊.

 

この前、ボーっとしてたときに、

私は１日何してすごしてるんだろうと考えてみたんですよ。

そうしたら、１日の３分の１を学校ですごしていることに気がつきました。

すごい！！

ということで！

私の学校生活の中で、

「 なくてはならないモノ 」を紹介したいと思います。

 

それは

☆ トントンすぎず、まるみすぎない鉛筆 ☆

 

私のこだわりです (’-’*)

学校のお友だちはトントンな鉛筆が書きやすいって言うけど、

私はトントンより少し先がまるくなっているのがいいんです ^^

書くときの力が強いから、

トントンの鉛筆だとすぐにポキポキおれてしまうのです (T^T)

さあ、今日はどの鉛筆けずりで

ベストな書き心地にけずろうかな・・・ふふふ・・・(-∀-)

だから、鉛筆けずりがたくさんあります(^w^)

[画像：桐畑カレン]

あれ、ということは( -_・)?

トントンすぎず、まるみすぎない鉛筆がなくてはならないモノ？

それとも鉛筆けずりがなくてはならないモノ？

頭の中がぐるぐるぐる～

分からなくなってきたので、今回はこのへんで( ´∀`)/~~