2017年3月9日(木),100年後の未来［瀧澤翼］,投稿者:瀧澤翼 | 投稿時間:18時54分 | カテゴリ：てれび戦士 | 固定リンク

こんにちは！
瀧澤翼です！
 
さぁ、今回のテーマは「 100年後の未来 」です。
 
100年後というと、
もしかしたら日本の平均寿命が延びすぎて、
僕も生きているかもしれない！
いや、もしかしたら不老不死の薬が開発されているかもしれません！
そのくらい100年は長い期間なので
なにが起こるのかわかりませんが、想像するだけでワクワクします。
 
僕は、100年後の学校は今より画期的であってほしいと思います。
例えば、玄関と教室がつながっていて登校時間の削減ができたり、
テストも紙ではなく空中に浮いてるモニターに文字を入力して
簡単に答えられるようにできるといいなぁ。
それとロッカーや引きだしの整理整とんなどは
指パッチンをすれば勝手に片づけてくれたり、
歴史の授業のとき、タイムスリップして
その時代のことをもっとくわしく知ることができるかもしれません。
 
考えるだけで、いろんな未来が見えてきます。
なので100年後の未来がすごく楽しみです！
 
ところで、テーマの話はこの辺にして、
「Let's天才てれびくん」での３年間を振り返りたいと思います。
今まで、日本各地へ行けて本当に楽しかったです！
そして、各地の人たちとの出会いがとても貴重な体験でした。
あと、地域の名産など、たくさんの知識が僕の財産となりました！
今までどちゃもん探しでお邪魔した都道府県の皆さま、
本当にありがとうございました！！
さまざまなミッションも
茶の間戦士の協力のおかげで成功することができました！
これからも僕なりに突っ走っていくので応援よろしくお願いします！


［画像：瀧澤翼］

Let's！！