2016年9月14日 (水),○○県の思い出［久保みのり］,投稿者:久保みのり | 投稿時間:18時45分 | カテゴリ：てれび戦士 | 固定リンク

みなさん。こんにちは♪( ´θ｀)ノ
みのりです！！
 
夏休みが終わっていよいよ学校が始まったのに、、、
私はかぜをひいてしまいました T^T
つらかったぁぁ。
でも、今はもう元気モリモリ！！
夏休みの最後に、小学校のお友達とバーベキューをしたときの写真。
楽しかったなぁ（^人^）

［画像：久保みのり］

＊.｡.:*・ﾟ ＊.｡.:*・ﾟ ＊.｡.:*・ﾟ ＊.｡.:*・ﾟ ＊.｡.:
では。今回のテーマは、
「 ◯◯県の思い出 」
 
少し前に、私は瀧澤くんといっしょに
埼玉どちゃもんのだんきちに会いに埼玉県に行ってきました！
私が住んでいる愛知県からは少し遠いし、あまり知らない場所だったんだけど、、
埼玉県には超有名なアイスクリーム工場があったり、
ダンボールの生産日本一でたくさん工場があったり、さつまいもがおいしかったり！！
あんまり楽しかったので、夏休みには家族ともう一回行ってきました！！
鉄道の博物館で昔の汽車を見たよ～。
そうそう！夏休みの社会の自由研究のテーマも埼玉県 (^-^)
すっかり気に入っちゃった ☆
 
でもでもやっぱり！
地元の愛知県も大～すき！！
飯島ちゃんといっしょに愛知どちゃもんのふぃろそふぃあにも会ってきたんだ ^ ^
 
みなさん、『 名古屋めし 』って知っていますか？
てばさき、みそにこみうどん、きしめん、みそかつ、天むす、ひつまぶし、、、
それから、、
モーニング ^o^
どれもおいしいんだよ～☆
わたしは、パンにあんこをたっぷりのせる「 小倉トースト 」が大好物 (^-^)

［画像：久保みのり、瀧澤翼、飯島緋梨］

そんな私の大切な名古屋を、
絶対にいじげんじゅうから守らなくちゃ。
みなさん、いっしょにがんばろうねっ！！！