2014年6月17日(火),小さな幸せ！［林武尊］,投稿者:林武尊 | 投稿時間:18時45分 | カテゴリ：てれび戦士 | 固定リンク

先日、運動会がありました。

騎馬戦や組体操、マーチングもあって楽しかった！

でも暑くて大変でした。

 

ちなみに、ぼくは白組でした。

 

さて、赤と白のどっちが勝ったでしょう？？

一の位は・・・どっちも0

百の位は・・・どっちも2

十の位は・・・（どきどき）・・・（どきどき）・・・

 

 

なんとどっちも6で、白組も赤組も優勝しちゃいました*\(^o^)/*

 

運動会の話でもりあがっちゃった*\(^o^)/*
[画像：林武尊]




本題に入ります(￣^￣)ゞ

 

ぼくの小さな幸せは、映画を見ることです。

映画館でもおうちでも、たくさん映画を見ます。

 

この前も、アナと雪の女王を見に行きました。

 

ぼくが映画館で見た映画の中で、特に印象に残っているのは、

ローワン アトキンソンさんが主演をしている

『ジョニーイングリッシュ 気休めの報酬』です。

理由は、ローワンアトキンソンさんがとってもおもしろいからです。

 

でも、最近あんまり映画が出ないからつまんない…

もっともっと映画を出してほしい！