2015年6月26日(金),自分にとって『特別な言葉』 ［小西憧弥］,投稿者:小西憧弥 | 投稿時間:18時45分 | カテゴリ：てれび戦士 | 固定リンク

こんにちは！憧弥です(^-^)/
<br>
誕生日にいっぱいの人からおめでとう！を言ってもらったり、
プレゼントをもらいました。
うれしかったです。
ありがとうございました(^_^)v
<br>
この前、近くの田んぼへザリガニ釣りに行きました。
いつも網は使わないで、たこ糸とスルメと、
その辺りに落ちている木を竿がわりにして釣ります。
その日は確か・・・４匹、次の週は１匹釣れました。
思ったより釣れなかったけど、
やっぱり釣りは楽しいなぁー（≧∇≦）
最後はちゃんと元の場所に逃がしてあげました。
それになんと、その帰り道クワガタも見つけて、
テンションちょーー上がったーー (^_^)v
[画像：小西憧弥]
<br>
それでは、お題にいきます！
「 自分にとって　『 特別な言葉 』 」です。
特別な言葉で思いつくのは、
お父さんとお母さんと約束したことで、
『 やるときゃやる！ 』です。
<br>
苦手なこととか、イヤだなぁと思うこととか、
できないだろうなぁって思うことでも、
やらなきゃいけないってときには、一生けん命やる！
できるできないよりも、
一生けん命やることが大事だよ！っていつも言われてます！
僕もそう思うから、
これからも　『 やるときゃやる！ 』で頑張ります(^-^)/