2016年9月19日 (月),○○県の思い出［桐畑カレン］,投稿者:桐畑カレン | 投稿時間:18時45分 | カテゴリ：てれび戦士 | 固定リンク

こんにちは。
カレンです (*^^*)
 
先日プラネタリウムに行ってきました。
宝石みたいにキラキラしてる
星と星をつなげて、
「 これはこんな形かな☆ 」
と星座を想像してきた昔の人は、
とってもぜいたくで素敵な時間を過ごしていたんだなあって、
うらやましく思いました。
ちなみに私が好きな星は
☆ 北極星 ☆ 
理由は、ずっとそこにあるから！です (*^^*)

[画像：桐畑カレン]

さて、今日のお題は「 ◯◯県の思い出 」です。
 
旅行で遊びに行ったところは、
いつもと違う経験ができて素敵な思い出ができますね (^^)
でもそこに、ちょっとハプニングが加わると、
さらに思い出深ーいものになったりしませんか？？
私はいとこと旅行をするとき、いつもは一緒に行くのですが、
たまたま現地で待ち合わせをしようというときがあったんです。
ところが、私が出発する日に大雪になってしまって！
乗るはずだった飛行機の時間がすっごく遅れて、
乗れたのは真夜中の12時を過ぎていました。
そして旅行先に着いたのは、午前２時くらいでした (T0T)
もう、公共交通機関も終わっていたから、
先に着いていたみんながレンタカーで空港まで迎えに来てくれました。
みんなに会えたときは、ほっとしました。
空港からホテルにむかっているとき、
雪で真っ白なんだろうなと思われる景色が、
道路の外灯のオレンジ色の光と一緒になって、
ぽわあってしててきれいだなーと思ったのを覚えています。
そして次の日からは元気に「 北海道 」を楽しみました。
 
 そう！ここは北海道～ (*^▽^*)
念願だった雪まつりに行って、雪の像や氷の像を見てすごい！と感動 (°▽°)
大好きないくらをたくさん食べたり、
おなかがぱんぱんになるまで北海道グルメを満きつ～ (*≧∀≦*)
ハプニングはあったけど、
それもいい思い出となって、北海道を楽しめました (*^^*)

［画像：桐畑カレン］