2014年7月18日(金),私だけが知っている法則［桐畑カレン］,投稿者:桐畑カレン | 投稿時間:18時45分 | カテゴリ：てれび戦士 | 固定リンク

こんにちは。カレンです(*^^*)

 

今、「鶴を折る」ブームがきています。

だんだん上手に折れるようになってきて、ミニ鶴さんも折れるようになりました！
[画像：桐畑カレン]


今回のテーマは、私だけが知っている法則です。

 

まずは、私だけ？な法則から

☆「春秋冬は大豆で、夏はアーモンド！」

 

「カレンちゃん、ちょっとやせた？」

夏になると、いわれ始めます。

 

いつもは、ほっぺたがプクプクしてて、おまめちゃん（大豆っぽい）といわれるんだけど、

夏は日焼けして、シュッとスリムに見えるそうです。

 

それって、アーモンドみたい？

 

だから、私は夏だけ大豆からアーモンドに変身？変豆？します(^^)/
[画像：桐畑カレン]


次に、みんなも？な法則。

☆「楽しみなことが待っていると、宿題がさっと終わる！」

 

この前、お友達と七夕祭りに行く約束をしました。

 

学校から帰って、すぐおやつを食べないでそろばんに行って、

（おやつを食べないなんて大事件です！でも、お祭りで食べられるから、がまんできました！）

それから集中して、ちゃちゃっとていねいに宿題を終わらせました。

 

楽しみなことがあると、パワーがでてきます(^O^)

 

いつもは、の～んびりていねいにしている宿題もあっという間に終わります。

 

みんなも、そうじゃないですか？

 

お友達みんなで行った七夕祭りは、とっても楽しかったです(*^^*)