2015年7月22日(水),とっておきの『夏の思い出』［小西憧弥］,投稿者:小西憧弥 | 投稿時間:18時45分 | カテゴリ：てれび戦士 | 固定リンク

こんにちは、憧弥です(^-^)/
<br>
ぼくの通っている小学校は、な・な・な・なんと！
７月17日が１学期の終業式だったんです！
だから夏休みが45日間で、いつもより４日長いんでーす！
うれしーーい（≧∇≦）
そのかわり宿題が多いかも・・・それは困るな・・・。
<br>
それではお題にいきます。
「 とっておきの『夏の思い出』 」です。
<br>
ぼくが３才の夏、初めて飛行機に乗って、沖縄へ家族旅行に行きました！
まだ小さくてハッキリと覚えていないけど、
とう明でプールみたいなキレイな海で、
カブト虫の浮き輪に乗って、浮かんでいたのを覚えています！
そのあと、どこの海に連れて行ってもらってもにごっていて、
今にもダツという口がとがった魚が飛んできそうで
泳ぐのがこわくてビビリまくりです (T_T)
また、あの底が見えるキレイな海で泳ぎたいなー。
<br> 
あと覚えているのが、琉球ガラスを作っている所に体験しに行ったんだけど、
憧弥は小さすぎて、お姉ちゃんしか体験させてもらえなかったことが
すごくくやしかったです。
今行ったらちゃんと作れるのになー。
またお父さんとお母さんに沖縄旅行、頼んでみよっと！
今年の夏休みも、いっぱい思い出作るぞー！
[画像：小西憧弥]