2015年9月25日(金),夢の記憶［笹原尚季］,投稿者:笹原尚季 | 投稿時間:18時45分 | カテゴリ：てれび戦士 | 固定リンク

こんにちは尚季です (^^)
<br> 
この前、お母さんの地元の群馬の、敷島公園とばら園に行ってきました。
敷島公園はすごーく広くて、アスレチックや木の家があったり・・・
[画像：笹原尚季]
カモさんがいてエサをあげていたら、鯉（こい）さんに横取りされてしまいました。
[画像：カモ]
鯉さんもお腹が空いてたんだ！
両方かわいかったから良かった！
<br> 
あとはばら園、
[画像：笹原尚季]
ばらの季節じゃなくて残念だったけど、
きれいな花が入り口にあったので写真を撮ってきました。
近くのお寿司やさんでお寿司もいっぱい食べて、
満足でした*･゜ﾟ･*:.｡..｡.:*･'(*ﾟ▽ﾟ*)'･*:.｡. .｡.:*･゜ﾟ･*
<br> 
今回のお題は、「 夢の記憶 」です。
僕は、いつもぐっすり寝ていて、
夢の記憶はないけれど、ちょっと不思議なことがあります。
寝る前にドラマの台本を覚えるのに、
セリフが多すぎて覚えられないときがあり、
順番がバラバラのまま整理できずに寝て起きたら、
きっちり覚えていた！ということが何度もありました。
<br> 
多分僕の脳が、朝起きたら困るだろうな～って考えて、
夢の中で、覚えきれていないところを一生懸命整理してくれているんだと思います。
僕は寝ていて記憶がないからわからないけれど、
助けてくれてありがとう！って感謝してます (o^^o)