2016年12月12日 (月),雪の思い出［桐畑カレン］,投稿者:桐畑カレン | 投稿時間:18時45分 | カテゴリ：てれび戦士 | 固定リンク

こんにちは。

カレンです (*^^*)

 

先日ふらりとお出かけしたところの道路が

真っ白なキャンバスになっていました。

その長さ、なんと700メートル（ 気になったから聞いてみました )！！

たくさんの人がお絵かきをしていたので、私も描いてみました (^^)

[画像：桐畑カレン]

題名「 地 球 」 カレン画

 

もうすぐ、大阪に異次元獣がやってきます。

おくとぱすみれを助けるため、地球の未来を守るために、

みなさん一緒にがんばりましょう L(‘▽‘)／

よろしくお願いします！！

 

☆★☆★☆★☆★☆★☆★☆

 

私の住んでいるところは、あまり雪が降りません。

パラパラと降ることがあっても、

雪が積もるのは年に１回か２回くらいなんです。

だから、雪が降ったらすっごくテンション上がります。

いつもは「 寒い寒い 」言ってるのに、不思議 (^o^;)

 

雪が降ったときに、必ずすることがあります。

それは「 雪の結晶 」の観察！

 

冷凍庫の中でクリアファイルを冷やして、ひえひえに冷えたら出します。

そこに黒い紙をささっとはさんで、

降ってくる雪をファイルの上にのせてあげるんです。

そうしたら、雪の結晶がみえるんですよ。

雪の結晶の形は、とてもきれいで大好きです。

ずーっと見ていたいのに、すぐに消えてしまうのが悲しい (T^T)

 

結晶つながりですごく見てみたいのがあるんですが・・・

それは

 

☆ダイヤモンドダスト☆

 

空気中の水蒸気が冷やされて氷の結晶になって、空から降ってくるそうです。

それが、太陽に照らされてダイヤモンドみたいにきらきら輝くみたいです。

降ってるあいだ、ずーっと見れるのかあ。

しかもダイヤモンドみたいに輝いてるなんて！！

見てみたーい (*≧∀≦*)

 

雪が大量にあったら、かまくらを作って、

その中で大好きなおもちを焼いて食べてみたいな