2015年10月2日(金),夢の記憶［杉本瑛］,投稿者:杉本瑛 | 投稿時間:18時45分 | カテゴリ：てれび戦士 | 固定リンク

みなさん、ゴーオンダイン（ アイスランド語で「 こんにちは 」です ）！
杉本瑛です☆
[画像：杉本瑛 桐畑カレン]
カレンちゃんと写真を撮りました (^O^)
いたずら好きの竜心君と辻村君が、後ろからピョコピョコと跳ねて、
なんとか写真に写ろうとしてました（＾∇＾）
この写真は２人のいたずらをよけて撮ったレアな写真です！
<br>
今回のお題は、「 夢の記憶 」です♪
<br> 
私の中で特に記憶に残っている夢は
２年生のときに見た夢です (^○^)
家族でお花見に行ってるときに、突然、忍者集団に襲われたんです (＞人＜;)
私とおじいちゃんおばあちゃんは
タクシーで家電量販店に逃げました（ 我ながらヒドイッ！）。
そして、パパとママはなぜか急に忍者服になって、忍者達と戦いはじめたんです (°_°)
しかも、いつの間にかパパとママの仲間の忍者まで出てきて、もう何が何だか。
起きちゃったからそのあとは分からないけど、
結局どっちが勝ったんだろう？
でも、現実じゃなくてよかった！
だって急に忍者集団に襲われたら怖いし、パパとママを置いて逃げたくないもん！
<br>
ママに夢のことを話したら、
「 夢の中まで時代劇なのね（笑）」と言われました ^_^
その頃、ドラマ『 妻は、くノ一 （ くのいち ）』の撮影中でした。
瀧本美織さんが演じていたくノ一（ 女性の忍者 ）役に憧れていたから、
こんな夢を見たんだと思います。
私ももっと殺陣（ たて ）や日舞を頑張って、いつか忍者役で時代劇に出てみたいな～