2014年6月16日(月),小さな幸せ！［飯島緋梨］,投稿者:飯島緋梨 | 投稿時間:18時45分 | カテゴリ：てれび戦士 | 固定リンク

私の小さな幸せは学校の出来事！

 

学校で運動会がありました。
[画像：運動会]

5年生になると6年生と一緒に組体操をします。

組体操では、ピラミッドをクラスで作ります。

練習のときは、いっしょうけんめい頑張ったのに、一度も成功しなくて不安でした。

なのに本番では大成功したのです！

 

とても嬉しかったです(^_^)

お母さんとお父さんとおばあちゃんも「感動したよ！」と言ってくれました。

 

緋梨の白組は負けちゃったけど、騎馬戦をしたり、リレーをしたり、

皆でいっしょうけんめい力を合わせて頑張ったので楽しかったです。
[画像：飯島緋梨]


あと私の小さな幸せは、なんと言ってもやっぱり

うちのネコのにゃうは、緋梨の事が一番大好き！という事です。

 

朝起きるとすぐに近寄って来て

スリスリゴロゴロ。

 

帰って来ると靴下をクンクン。

 

学校に行くときも帰って来たときも

いつも玄関まで送りむかえしてくれます。

 

でもでも、ご飯をあげると、甘えてきてくれたのがウソのように知らん顔になります。

やっぱりご飯が欲しかっただけ？

ガーン(￣▽￣)

 

それでもにゃうが大好き！

にゃうが甘えてきてくれる事が小さな幸せです。
[画像：飼い猫にゃう]
