2016年3月10日(木),「春はLet's ○○」［笹原尚季］,投稿者:笹原尚季 | 投稿時間:18時54分 | カテゴリ：てれび戦士 | 固定リンク

こんにちは！
いつも元気な笹原です！
[画像：笹原尚季]
冬の間大変お世話になったもふもふパーカー、とっても離れがたいです。
でも花粉には勝てない・・・(>_<)
目はかゆいし、くしゃみも止まらないし
[画像：笹原尚季]
あきらめて、花粉の付きにくいパーカーにしてお出かけです。
マスクが欠かせない季節になりました。
<br> 
前にペットを２匹飼っていることをお話ししましたね。
かめさんは毎日こうら干しをがんばって、とっても成長しました！
でも、くまさんは（ ハムスターの名前です ）全然成長しません・・・(°_°)
食べるものや量で、すぐに太ったりやせたりはするけど、
全然大きくなりません。
心配・・・
と、思っていたら！！
エサを買いに行ったペットショップで、
１／３サイズのキンクマハムスターちゃんを発見。
あれれ？？
うちのハムスターは、もうおとなだったのかも。
あいかわらず２匹ともかわいいです♪
<br> 
それでは、本題に入ります！
今回は、「 春はLet's ○○ 」です！
<br> 
春といえば、お花見ですよね！
でも、僕が楽しみなのは、運動会と、新学期が始まることです！
運動会では、団長になりたいです！
みんなの前に立って、笛を吹いたりしてすごく楽しそうだからです。
ちなみに、去年は副団長をやりました。
とっても楽しかったです ^_^
新学期では、仲のいい友達と同じクラスになれるかなぁーとか、
どんな先生なのかなぁーって気になります！
すごく楽しみです！！
あと、新年度から通学班の班長になります (^｡^)
がんばります！