2016年12月27日 (火),ゆく年くる年［林武尊］,投稿者:林武尊 | 投稿時間:18時45分 | カテゴリ：てれび戦士 | 固定リンク

こんにちは、林武尊です。

 

この前、帰り道で、みのりと一緒に “ 歌詞乗っ取りゲーム ” をしました！

結構難しい(￣▽￣;)

「 世界に一つだけの花 」→「 チューリップ 」

→「 世界に一つだけの花 」→「 チューリップ 」のくり返しで

一向に進みませんでした (´▽`)

ほかにも “ ドレミの歌ゲーム ” とかをして楽しい時間を過ごしました( ˙︶˙ )

[画像：久保みのり、林武尊]

今回のお題は【 ゆく年くる年 】です。

 

もうすごく寒いですね～

みかんがおいしい季節です (*´～｀*)ŧ‹"ŧ‹"ŧ‹"

まずは、来年の抱負を発表したいと思います｡

 

来年は冒険的な１年にしたいです (￣^￣)ゞ

今の友達と、電車や自転車でいろんなところにでかけて遊びたいです。

お腹がすいたらご飯を食べて、欲しいものがあったら途中で買って、

いろんなことを話してみたいです！

夏休みは、行ったことのない都道府県に行きたいです。

京都とかがいいなー

八つ橋食べてお寺めぐりをして、

いっぱい遊んで、いっぱい観光して帰りたいです。

 

今年の年末は、おばあちゃんの家で、

いつも見ているテレビを見て過ごしたいと思います。

久しぶりにいとこも帰ってくるので楽しみ o(*ﾟ▽ﾟ*)o

でも勉強もしなきゃ (´-﹏-`；)

今年みたいに来年もがんばります！！ (ง •̀_•́)ง

では良いお年を～