2016年7月25日 (月),夏が来た！［久保みのり］,投稿者:久保みのり | 投稿時間:18時45分 | カテゴリ：てれび戦士 | 固定リンク

こんにちは ( ´ ▽ ` )ﾉ

みのりです！！

 

たっのしい夏休みがはじまりました ☆

前回のブログで、

夏を元気にすごせるように梅ジュースのことを書いたけど、

もう１つ私が元気モリモリになるアイテムがあります！！

それは、、、

「 ギョウザ 」です (⌒▽⌒)

外はかりっと中はじゅわっ！！

そうぞうするだけでヨダレがでてきます。

お店で食べるのもおいしいけど、

おうちで作るのも楽しくて大好きです^ ^

弟と一緒に120こ作ったんだよ～。

[画像：久保みのり]

今回のテーマは「 夏が来た！ 」

う、うれしい～っっっ！！

なにしよっかなぁ。

 

まずは大好きなプールにとびこんで、

それからバーベキューもしたい！

カブトムシを探しに行きたいし、

ドラゴンズの応えんにも行きたい！！

トマトの丸かじりもしたいなぁ。

でもその前に宿題もけっこうあるからな T_T

８月の終わりにこまらないように、

あと回しにしないで先にやらなくちゃ！！

 

４年生になって、社会の授業で都道府県について勉強しました。

夏休みの自由研究のか題は、どこか１つの都道府県についてまとめること。

私はどこにするかもう決めました！

こないだ、どちゃもんのだんきちと仲よくなれたから、

だんきちの住んでいる県についてまとめるんだ ^ ^

どこにしたか、わかるかな？ ^ ^

[画像：久保みのり]

レッツ早寝早起きで夏休みをいっぱい楽しむぞ～！！