2014年5月26日 (月),未来の自分！［小西憧弥］,投稿者:小西憧弥 | 投稿時間:18時45分 | カテゴリ：てれび戦士 | 固定リンク

こんにちは(^o^)/憧弥です。

名前覚えてくれましたか？

 

もうちょっとで夏？スイカ食べれるかな？かき氷も……

 

 

あ！そうだ本題にいかなきゃ？

今回は『未来の自分！』

 

今は10歳。

もうすぐ11歳なので20年後は、31歳！背が伸びてたらいいな…。

 

お父さんになってて、子供がいて、一緒にキャンプとか釣りとか、野球とかしてるかな。

 

趣味かもしれないけど、釣りは続けてるはず！

バスプロになれてたら、すごくうれしいなd(⌒o⌒)b

 

もう少し大きくなったら、船の免許を取って、船を買って、毎日湖に行けてたら最高？

[画像：小西憧弥]

 

今はてれび戦士になれて、すごく楽しいので、俳優さんみたいに、

テレビに出るお仕事も続けられたらいいな。

ドラマや映画、テレビにいーっぱい出てる未来、想像するだけで楽しいo(≧▽≦)o

 

まずは、いっぱい食べて、いっぱい牛乳飲んで、いっぱい寝て、大きくなるんだ！

[画像：小西憧弥]