2017年1月11日 (水),冬のお楽しみ［辻晴仁］,投稿者:黒川桃花〔原文ママ〕（正：辻晴仁） | 投稿時間:18時45分 | カテゴリ：てれび戦士 | 固定リンク 

あけましておめでとうございます！

今年も元気 いっぱい！

つじはるとです ＼(^o^)／よろしくね。

 

ここで速報！なんとなんとなんと～～

わが家の家族に、新しい仲間、

ニジイロクワガタちゃんが加わりました♪

イェーイヒューヒューヒュー！！！

すみません、うれしくて盛り上がり

すぎました。。

[画像：辻晴仁]

このニジイロクワガタちゃん、

すぐにひっくり返ったり、

エサのゼリーを土にうめて

ドロドロにしてしまったり、、、

ほんとに手間のかかる子なんです。

でも、そんなとこが

よけいにかわいいんですよ (*^^*)

 

・・・・・・・・・・・・・・・・・・・

 

さて、今回のテーマは、

「 冬のお楽しみ 」です。

 

冬のお楽しみといえばやっぱり、

「 こたつとみかん！ 」

これで決まりです！

 

以前のブログで、

雪の中で犬みたいにかけ回るぼくを

紹介したのですが、

じつは、ぼくは、あったか～いこたつの中で

ねこみたいにまんまるくなるのも

大好きなんです。

学校から帰ってきて、

真っ先にぽかぽかのこたつに飛びこんで、

つめた～いみかんを食べる！

ああ、幸せ～～ (*´▽｀*)

[画像：辻晴仁]

気づくと、よだれたらしてねちゃってたりするんだよね。