2015年3月11日(水),私の好きなニッポン［飯島緋梨］,投稿者:飯島緋梨 | 投稿時間:18時45分 | カテゴリ：てれび戦士 | 固定リンク

みなさん！こんにちは^o^

飯島緋梨です。

 

最近、インフルエンザが

学校で流行っています。

 

緋梨は、予防接種をしてるのに、

毎年インフルエンザになってしまいます(>_<)

 

でも今年こそは、大丈夫かも！

みなさんも気をつけてくださいね(^_^)

 

 

 

今回のお題は、「 私の好きなニッポン！」

 

私が好きな日本は、季節があること。

 

春は桜が咲いて、

夏はとっても暑くって、

秋は紅葉がきれいで、

冬は寒いけど雪が降ったら楽しい♪
[画像：飯島緋梨]
未来でも、この四季が続くといいなと、私は思います^_^

 

 

それから！

日本には、梅干しがある(^O^)／

 

私は、梅干しが大大大好き！

 

すっぱくて、しょっぱいのが

たまらなくおいしい(^｡^)

 

そんな梅干しは、なんと古代からあったそうです！

 

でも昔は、食べ物ではなく、

漢方薬として使われていたんだって！

 

 

そして、最近ハマっているのは折り紙！

本を見て、折り紙を折ってみました。

 

いろいろと種類があって楽しい♪

もっと作りたいと思います（≧∇≦）
[画像：折り紙]
Ｌet's 折り紙(o^^)