2015年1月29日(木),これってキセキ！？［林武尊］,投稿者:林武尊 | 投稿時間:18時54分 | カテゴリ：てれび戦士 | 固定リンク

こんにちは！林武尊です！

 

この前、緋梨ちゃんと竜心と一緒にNHKのスタジオパークに行きました。

 

そこで、アフレコやニュースの体験コーナーに挑戦しました。

緋梨ちゃんがメインキャスター、竜心がお天気キャスター、ぼくはリポーターをやりました。

 

本物のニュースに出ているみたいで、

みんなで盛り上がってすごく楽しかったでーす(^O^)／

 

みんなもスタジオパークに遊びに来たら、ぜひぜひ挑戦してみてくださいね。
[画像：小澤竜心、林武尊、飯島緋梨]


では、本題に入ります。

ぼくが 「 これってキセキ！？」 って思うこと。

 

それは、今までやってきたことが、今につながっているということです。

 

なぜなら、この何億人もいる人の中で日本に生まれて、

今自分のまわりにいる友達は、ほんのわずかです。

 

でもぼくが別の時代や、ほかの国に生まれていたら、みんなに会えていなかったし、

それまでに違うことをしていたら、まったく別の人生になっていたかもしれない。

 

そう考えたら、今の友達に出会えたことって、

キセキだなーと思います☆*:.。.o(≧▽≦)o .。.:*☆

 

よく考えて行動しないと、もしかしたら悪い人にも出会うかもしれません。

 

だから何かをするときは、

よく考えて人生をいい方向に向けて行動したいと思います！

 

Let's！L(^O^)
[画像：林武尊]