2016年10月14日 (金),好きな漢字［林武尊］,投稿者:林武尊 | 投稿時間:18時45分 | カテゴリ：てれび戦士 | 固定リンク

こんにちは、林武尊です。

 

もう秋ですね～

秋といえば、食欲の秋！！

僕は魚が好きなので、おいしいサンマを塩焼きにして食べたいです。

 

あと、ハロウィーンももうすぐですね。

今度は、こういう仮装にしようかな～

[画像：林武尊]

では、本題へ。

今回は、“ 好きな漢字 （ ひと文字 ）”ですね。

 

僕が“ 好きな漢字 ”は・・・

自分の名前、“ 武尊 ”　です。

 

この字は“ 武を尊ぶ ”と書きます。

この名前を見て、理科の先生に

「 お前、ケンカ強そうだよね 」　と言われました。

ちょっとうれしかったです。

他にも、僕のひいおじいちゃんが“ 武一 ”という名前で、

ひいおじいちゃんを尊敬しているという意味でもあります。

なので“ 武尊 ”という字は、

僕にとって好きな字でもあり、大事な字でもあるんです。

 

でも今回は、好きな漢字「 ひと文字 」ということで、

どっちか選ぶの難しいな・・・

ひいおじいちゃんと同じ“ 武 ”にしようかな！

 

あと“ 凸凹 ”（ でこぼこ ）という字。

記号みたいで面白いですよね～

皆さんはどんな漢字が好きですか？