2017年1月17日 (火),冬のお楽しみ［稲垣芽生］,投稿者:稲垣芽生 | 投稿時間:18時45分 | カテゴリ：てれび戦士 | 固定リンク

新年です。

みなさま、今年もよろしくお願いします。

 

年末、黒川ももかちゃんの音楽コンサートをみてきました。

遠い存在で大きくて素晴らしい　ももかちゃん。

がんばっている姿に、元気とやる気をたくさんもらいました。

[画像：黒川桃花、皆川寧々、稲垣芽生]

ももかちゃん。

ありがとう。

 

今回のテーマは【 冬のお楽しみ 】です。

冬と言えば・・・みんなのお家にもあるかな (*^^*)

私の大好きなコタツ！！！

冬といえばコタツ！！！

テーブルの上にはミカンが必ず乗っています。

[画像：みかん]

コタツでぬくぬくして

ミカンを食べたり本を読んだり

おそばを食べたり・・・

 

寒～い冬の日もコタツがあれば

心もあったかです。

家族４人で囲んで

足でちょっかいをだしあったり

かるたやトランプをするのも楽しい。

 

でも、寒い冬の外のキーンっていう空気も好き。

う～寒いね～って笑っちゃう。

この寒いのを過ぎたら

もうすぐ私の誕生日。って思えるから好き。

 

みなさんの冬のお楽しみも聞きたいです。

そうしたら一層冬が楽しくなりそう！

[画像：稲垣芽生]