2016年6月23日 (木),大人になれば［柿澤仁誠］,投稿者:柿澤仁誠 | 投稿時間:18時54分 | カテゴリ：てれび戦士 | 固定リンク

こんにちは！仁誠です (^○^)

今回のテーマは「 大人になれば 」

 

ぼくが大人になったら、、、

うーん！何にしようかなー？

そうだ！

漢字がすらすらかける

カッコいい大人になりたいです！！

でもぼくがそんな大人になれるかが、ビミョウです (￣―￣?)

 

なぜかというと、

少しでも漢字をおぼえられるようにどりょくしているのに、

次から次へとどんどん忘れてしまうんです ((T_T))

[画像：柿澤仁誠]

(；Д；) どうしたらいいのか、

だれか教えてください！！！！

 

年上のセンパイに聞いてみたら、

アドバイスがもらえました v(￣ー￣)v

それは漢字ノートに漢字を書くときに、

読みがなを１つ１つていねいに声に出してから書くことです！

あとは夜だけじゃなくて

朝、少しでも漢字練習をしておくと、

おぼえられるらしいんです！

 

この前の漢字テストでさっそくためしてみたら、

意外と漢字が書けたような気がしました (*^.^*)

４年生になって漢字もどんどんむずかしくなってるので、

これからも工夫してがんばります。

６年生の漢字なんて、そうぞうするのもおそろしいです ((T_T))

ではまた (@^^)/~~~