2016年5月25日 (水),なくてはならないモノ［小澤竜心］,投稿者:小澤竜心 | 投稿時間:18時45分 | カテゴリ：てれび戦士 | 固定リンク

こんにちは！竜心です。

 

ぼくの『 なくてはならないモノ 』、

それは・・・【 バリカン 】です！！

 

ぼくは、勝負のときや大事な日の前に、

必ずバリカンで頭をそってもらいます。

頭をそると、さっぱりして、

勇気とやる気がわいてきます♪ヽ(´▽｀)/

[画像：小澤竜心]

そってくれるのは、いつもお父さんです。

バリカンには、髪の長さを調節できる

刃がいくつかありますが、

ぼくは、１ミリの刃を使っています。

バリカンは２台、持っています。

『 バリカン１号 』と『 ２号 』です。

もしも、そっている途中で、

バリカン１号の調子が悪くなっても、

２号がいるから大丈夫なのです～ d(⌒ー⌒)！

 

いつか、マイバリカンで、

自分で頭をそってみたいです。

正面はできそうだけど、

後ろはむずかしそうなので、修行しないと！

 

そりたての頭は、自分でさわっても

とても気持ちいいです。

友だちには、「 ご利益（ りやく ）がありますように～。」

と、さわられますが、

いいことがあるのかな～・・・f(^_^;)

でも、みんなに頭をなでてもらえて、

とてもうれしいです。

 

大人になっても、

バリカンを大切に使っていきたいです o(^o^)o