2014年6月5日(木),小さな幸せ！［小西憧弥］,投稿者:小西憧弥 | 投稿時間:19時20分 | カテゴリ：てれび戦士 | 固定リンク

こんにちは！憧弥です(^o^)

 

この前、学校で調理実習がありました。

玉子をゆでて、いろんなかたさのゆで玉子を作って食べました。

 

お父さんは玉子が大好きなので、家に帰ってさっそく、作ってあげました！

『おいしい！』って言って食べてくれました。

また作ってあげようと思います。

 


 

今度のお題は『小さな幸せ！』

幸せって考えたら、いっぱいありました。

 

学校から帰ったときのおやつ。

 

宿題が終わった後のゲーム。

 

好きなテレビを見てるとき。

 

スイートポテトや焼き芋を食べてるとき。

 

釣りに行く前に釣りざおにリールやルアーをセットしてるとき。

 

ラーメンを食べてるとき。

 

…いっぱいあるけど、ダントツで1番は、夜寝る時、布団に入ったしゅん間です。

大好きな肌布団があって、そのふわふわの布団にくるまったしゅん間が

1番幸せです！！！

 

みんなの小さな幸せも聞きたいなーo(^_^)o

[画像：小西憧弥]