2016年4月6日 (水),私の得意ワザ！［柿澤仁誠］,投稿者:柿澤仁誠 | 投稿時間:18時45分 | カテゴリ：てれび戦士 | 固定リンク

こんにちは。

ぼくは、新てれび戦士の柿澤仁誠です。

ブログを書くのは生まれてはじめてなので不安だけど、

みんなに楽しんでもらいたいので、がんばって書きます。

 

今回のテーマは、「 私の得意ワザ！ 」

ぼくの得意ワザは空手です！！

でも、じつはどうどうと言えるほどのレベルではないです。

なのでもっとこれからも練習をがんばろうと思います。

 

あともう１つ、得意ワザにしたいと思っているものがあります。

それは、けん玉です！

[画像：柿澤仁誠]

クリスマスにけん玉をもらったときから

大好きになりました！

せいこうするとすごくうれしいからです！！

コレがぼくの、けん玉です！　

[画像：柿澤仁誠]

すごくボコボコになってしまいましたが、

大事にしています。

 

ぼくも林たける君みたいに、

“ とくぎはけん玉！ ”と言えるぐらいがんばりたいです！！

↑ 実はこの前、林たける君にむずかしいワザを教えてもらいました！

今はそのワザをとっくんしています (^o^)