2013年10月14日 (月),【押忍！シャイ番長友情の旅】　第１３回　金子の日記,投稿者:大天才テレビジョン社員１号 | 投稿時間:18時54分 | カテゴリ：お知らせ！ | 固定リンク

「押忍！シャイ番長友情の旅」１３回目の放送、ご覧いただけましたか？

今回の友達ターゲットは「金子さん」。

群馬県沼田市利根町にある大楊地区という集落は、住民のおよそ７割が、「金子」さんという珍しい地域。
どこもかしこも金子さんばかりなので、「金子さーん！」と呼ぶと、
みんな振り向いてしまう、という珍光景を、ロケ中に何度も目にしました！
シャイ番長は、余裕しゃくしゃくで友達探しを始めたものの、シャイ番長のロケはぶっつけ本番。そんなに甘くはありませんでした…。
試合の日は予定がある、と、会う人会う人に断られます。
しかも、ロケをしたのは8月中旬の猛暑日。日中の気温は、なんと36度を超えていました…！
ちょっと歩くだけで、汗だらだら、喉はカラカラ。
次第に、シャイ番長の心は、折れていきました…。

山あり谷ありの展開を、シャイ番長の日記でもお楽しみください。
左クリックをすると、原寸大になります。



［画像：金子の日記］
  