2016年8月5日 (金),夏が来た！［林武尊］,投稿者:林武尊 | 投稿時間:18時45分 | カテゴリ：てれび戦士 | 固定リンク

こんにちは、林武尊です。

 

この前、おばあちゃんの家に帰りました。

お庭に水をやったり、温泉へ行ったりして楽しみました。

[画像：林武尊]

では本題へ。

今回は“ 夏が来た！”です。

 

もう夏ですね～

家の中も暑いので、せんぷう機を回して

アイスを２～３本食べて過ごしています （汗）

 

そこで、僕の今年の夏にやってみたいこと！

僕はアイスが大好きです。

で！　　　

今年の夏は、アイスにまつわる

いろいろなことに挑戦したいと思っています！

 

まずは、アイスを種類別に分けて、

それを１つにして食べることです。

たとえば・・・・・

チョコ味やミルク味など、

甘い系はお皿に入れて溶かして、また凍らせて食べる！

氷系は、そのままつぶして、かき氷みたいにして食べる！

他にも、“ アイスの食べ比べ ”や

“ 利きアイス ”をやってみたいです。

食べて種類を当てるだけでなく、匂いで当てるとか・・・

それから自分でもアイスを作ってみたい！

アイスを食べて、楽しんで、涼しくなって、もう最高（≧∇≦）

 

みなさんも、暑い夏をアイスを食べて乗り切ろう！　

でも食べすぎには注意しましょう！

お腹痛くなるからね (~_~;)