2015年3月23日(月),4月から○○年生になります！［飯島緋梨］,投稿者:飯島緋梨 | 投稿時間:18時45分 | カテゴリ：てれび戦士 | 固定リンク

こんにちは！飯島緋梨です！！

 

この前、NHK横浜放送局のイベントに行きました！

 

登場したとき、

想像よりもおおぜいの人がいて、

すごくきんちょうしました。

 

遊びに来てくれたみなさん、

ありがとうございました（≧∇≦）

 

 

帰りは、中華街で遊んで、

おいしいショーロンポーとごま団子を食べました。

 

ごま団子は、モッチモチでゴマがおいしくて、なんと4個も食べてしまいましたo(^_^)o

中華街に行ったときは、ぜひ食べてみてくださいね♪

 

トリックアートのミュージアムにも行きました。
[画像：飯島緋梨、小澤竜心、辻村晃佑]
不思議過ぎて、楽しかったですo(^_^)o

 

 

さて、今回のテーマは、

【 4月から6年生になります！】 （≧∇≦）

 

わたしが楽しみにしていることは、委員会！

 

わたしの学校では、

代表委員・放送委員・ 体育委員・集会委員・飼育委員などなど、

たくさんの委員会があります！

 

5年生のときは、

放送委員をしていました！（≧∇≦）

 

放送委員は、すごく楽しかったけど、

6年生になる今年は、集会委員になりました！

 

集会委員は、ゲーム説明や司会進行をしたりする委員会で、

いつも集会のとき6年生と5年生が協力している姿を見て、

私も集会委員をやってみたいと思いました！

 

しかも、お友達と一緒に集会委員になることができました(*^_^*)

 

はじめての集会委員だけど、

5年生と力を合わせて、楽しい集会ができるといいなと思います！！

 

みんなも委員会、頑張ってね(⌒▽⌒)

Ｌet's 委員会活動⊂((・x・))⊃