2016年10月21日 (金),○○にありがとう［小澤竜心］,投稿者:小澤竜心 | 投稿時間:18時45分 | カテゴリ：てれび戦士 | 固定リンク

こんにちは！竜心です。

 

この前、中学校の見学に行きました。

勉強や制服、そして・・・部活動！！！

たいへんなこともあると思うけど、

楽しみだな～ ("⌒∇⌒")

 

この小学校生活６年間で 、

「 ありがとう！ 」を言いたい物があります。

 

それは『 ランドセル 』と『 リュックサック 』です。

ランドセルは、

雨の日も風の日も一緒に学校に通っている、

ぼくの、相棒です♪

いつも・・・ありがとう～～！

[画像：小澤竜心]

リュックサックは、１年生から使っていて、

遠足の時や、少林寺拳法やダンスの稽古（ けいこ ）に行くときに、

いつも一緒です。

ありがとう～～～！！

 

買ってもらったときすぐに、

目立つところに自分で名前を書きました。

それを見たお母さんは、

「 え！？こんなところに書いちゃったの！？ 」

と、ズッコケていました！！

[画像：小澤竜心]

もう、ヒモがフサフサしてきて、

たま～に自然にチャックが開いちゃったりするけど、

まだまだ、使うぞ～ (*´ー｀*)

 

中学生になったら、

ランドセルとリュックサックとはお別れかな・・・。

これからも感謝して、

物を大切にしていきたいです d(⌒ー⌒)!