2013年10月31日 (木),【読書の秋２０１３】岡田結実,投稿者:岡田結実 | 投稿時間:18時00分 | カテゴリ：We are 大天才テレビジョン | 固定リンク

★読書の秋２０１３★
本じゃなくって、絵本なんですけど、

バムとケロのシリーズ
バムとケロのそらのたびっていうやつで、

たまたま片づけしてたら、この本がでてきて、
ちょっと読んでたら･･･ほかのシリーズもずっと見てしまいました。

これは、ある日家にいたら、バム（犬）のおじいちゃんから手紙がきて、
おじいちゃんの誕生日だから家に来て！みたいなことが書いてあって、
おじいちゃん家に向かうまで大変なことが起きるんです。

虫がうじゃうじゃいるりんごの中に入ってしまったり、色々なことがあるけど、おじいちゃん家につくんですが！！

絵も可愛いし、話もドキドキワクワクするぼうけんの話みたいで、すごくオモシロいです。（絵本だけど。。。）
オススメです。


［画像：岡田結実］
 
★倍返ししたいこと★
自分は、バスケが大好きで、このあいだ大人の人とバスケをやったんですが、

背も高くて全ったく勝てなくて、もっともっと上手くなれるよーに、いっぱいバスケを練習して、
いつかめっちゃ上手くなって倍返ししますっ！＾ｖ＾

先に１０点取ったほーが勝つっていうルールだったんですが、

２点しかとれなかったので、倍の倍の倍の倍の倍返ししますっ！

がんばります。