2016年7月28日 (木),夏が来た！［瀧澤翼］,投稿者:瀧澤翼 | 投稿時間:18時54分 | カテゴリ：てれび戦士 | 固定リンク

こんにちは！

いや～暑い（ーー；）

でも、夏は学校で体育の時間に水泳があるのでうれしい瀧澤翼です！

 

さぁ、今回のテーマは「夏が来た！」ですね。

最近ひそかに話題になっている

千葉県の『 農溝（ のうみぞ ）の滝 』に行ってきました！！

[画像：瀧澤翼]

「 家族で行ってみたいね！ 」って話していたので

お父さんがドライブに連れてってくれました！

すごく幻想的でなにかすごいパワーを感じました！

運が良ければ、太陽から差し込む光が

下の水に反射してハートの形になると言われています！

見てみたいなぁ～！！

でもいい思い出ができました！

 

と、いうわけで僕の夏は「 自然 」です！

今年の夏は自然に触れたり、感じたりしたいです！

自然の不思議や大切さなど、魅力をどんどん知っていきたいです。

[画像：瀧澤翼]

夏休みの自由研究はこれで決まり（＾∇＾）

では、また今度！

Let's nature！！