2017年1月13日 (金),冬のお楽しみ［皆川寧々］,投稿者:皆川寧々 | 投稿時間:18時45分 | カテゴリ：てれび戦士 | 固定リンク

みっなさ～ん、

こんばんは、＊寧々＊です(｡・u・｡)/☆

[画像：皆川寧々、桐畑カレン]

去年のクリスマスイブは

黒川桃花ちゃんのクリスマスコンサートに行ってきました。

ステージの上でスポットライトを浴びる

桃ちゃんの澄み切った歌声と華麗（ かれい ）なダンスにうっとりし、

兵庫どちゃもん・おくとぱすみれと桃ちゃんが重なり、

ますます桃ちゃんのことが

大好きになってしまいました！

 

さてさて本題へ今日のテーマは、

『 冬のお楽しみ 』

 

冬にもなるとバスケの帰りはもう真っ暗で、

空を見上げるとアレがものすごく綺麗なんです！！！！

それは、月と星です！

冬空をみることが冬のお楽しみです！

 

冬の夜空は空気が澄んでいて、

月も星もとても綺麗に見えるんです。

この前、理科の時間に月のことを習ってから、

月の出ている日は月がどんな形をしているかを見るのが密かな楽しみです。

新月、三日月、上弦の月、下弦の月、満月・・・

（ 小さいときは満月、三日月、半月の３つしか月の名前を知りませんでした。 ）

くもっている日以外でも、月が見えない新月という日があることを初めて知りました。

去年の11月と12月の満月は、月と地球の距離が近くてとっても大きく見えました。

肉眼では綺麗に見えても、なかなか写真ではうまく撮ることができないので、

何かいい方法があれば教えてください(*・u・*)／

 

冬は寒い日が続くのでプラネタリウムに行くのも楽しいですよね！

みんなの冬のお楽しみたくさん知りたいです！

[画像：皆川寧々]

それでは＊寧々＊でした♪