2016年9月27日 (火),○○県の思い出［小澤竜心］,投稿者:小澤竜心 | 投稿時間:18時45分 | カテゴリ：てれび戦士 | 固定リンク

こんにちは！竜心です。
 
夏が終わって、もう、秋ですねー。
今年の夏は秋田に行けなかったけど、
おじいちゃんから野菜がいっぱい届きました！
新鮮ですっごくおいしかったです。

［画像：小澤竜心］

夏まつりでは、初めてお手伝いをしました。
ご近所さんといろんなお話ができて、
お手伝いもほめられて、うれしかったです！

［画像：小澤竜心］

そして、NHK名古屋局のイベントに、
参加させていただきました！
会場ではたくさんのみなさんが応援してくださり、
心強かったです。
ありがとうございました！！
夏も思い出がたくさんできて、うれしいな～♪
 
ぼくの「 ○○県の思い出 」は『 山梨県 』です。
５年生のときに林間学校で山梨県に行って、
初めて学校の友達といろいろ過ごしました。
キャンプファイヤーや川遊び、
みんなで一緒にお風呂に入ったり、
山梨名物の「 ほうとう 」も作りました。
楽しかったな～～(≧▽≦)
 
朝早く起きて見た空の色も、忘れられません！
うっすらとした水色の上から、
うすーい紫がかかっていました。
キレイだったな～～・・・(*´ー｀*)
泊まるところは山にかこまれていて、
窓を開けると山のにおいがして、
鳥の鳴き声や川の音が聞こえてきて、
いやされました・・・(*´ー｀*)
 
『 山梨県 』は、自然がいっぱいで、
友達とたくさん話して仲良くなることができて、
とっても良い思い出になりました♪ヽ(´▽｀)/