2016年1月20日(水),お気に入りの食べもの［辻村晃佑］,投稿者:辻村晃佑 | 投稿時間:18時45分 | カテゴリ：てれび戦士 | 固定リンク

どうもー辻村晃佑です！
いやー、お正月はたくさんのんびりしましたよー！
おせちを食べたり、お年玉をもらったり
とにかくのんびりだらだらしていました ！
でもそのぶん、最初の学校の日の朝は
起きるのがつらかった (/´△`＼)
<br>
さて、本題です！
今回のお題は「 お気に入りの食べもの 」です！(￣▽￣)
<br>
食べものか～
正直いろいろあって迷いますね (´Д｀)
だがしかし、みなさん知ってのとおり僕は日本人です (｀・ω・)
僕の一番は、日本人がたぶん一番食べている「 お米 」です！(°д°)
さて、みなさんの予想のはるか上を越したと思うのですが、
これには理由があるんです！
<br>
あれは僕が小学4年生の頃の、少し寒くなってきたある日、
お父さんが北海道のおいしいお米を買ってきたんです。
しかしそのときの僕は
「 おいしいと言ってもたかがお米だ 」と思っていました。
それが、そのお米を炊いたご飯を一口食べた瞬間、驚きました (・◇・)
「 お米ってこんなに甘いんだ！ 」
それからお米が大好きになりました！(￣▽￣)
<br>
「 お米 」
それが僕の一番のお気に入りの食べものです (｀・ω・)
そして僕は、お米に合うおかずを作るため
料理をがんばっています！( ´ ▽ ` )
[画像：辻村晃佑]