笛チーム,髙橋郁哉、木内江莉,２００５,木曜生放送「ユゲトモ」
札付きワルズ,古坂大魔王、加藤謙太郎（春夏秋冬）、正岡久義、<br>矢部昌暉、木島杏奈、鎮西寿々歌、寺田朱里、<br>ファデン咲美亜、岡田結実、勝隆一、島田太一,２０１１,「札式蹴り野球」
札付きワルズ,古坂大魔王、金子隼也、加藤謙太郎（春夏秋冬）、<br>正岡久義、島田秀平、尾形貴弘（パンサー）、<br>鎮西寿々歌、寺田朱里、長谷川ニイナ、<br>岡田結実、島田太一、ソーズビー航洋、竹原司,２０１２,「フダケリ〜ワルズの逆襲〜」
札付きワルズ,古坂大魔王、金子隼也、加藤謙太郎（春夏秋冬）、<br>正岡久義、島田秀平、尾形貴弘（パンサー）、<br>長谷川ニイナ、岡田結実、島田太一、<br>ソーズビー航洋、野田真哉、竹原司,２０１３,「フダケリ〜ワルズの野望〜」
ふたりいる。,岩井七世、俵小百合,２００３,MTK「ぼくらのロック・シティ」<br>MTK「サンデーモーニング」コーラス
プチ・チェリーズ,安齋舞、徐桑安,２０００,MTK「歩いていこう」
普通チーム,レッド長官、浅野優梨愛、木村遼希,２００５,木曜生放送「ユゲトモ」
ブラックキャッツ,井出卓也、前田公輝、ジョアン・ヤマザキ、近藤エマ,２００３,冬イベ「モンキー座のゴルゴ13面相」
ブラックチーム,ゴルゴ男爵、洸太レイシー、橋本甜歌,２００５,木曜生放送「ユゲトモ」
ブラックチーム,ゴルゴ男爵、千秋レイシー、一木有海,２００５,木曜生放送「ユゲトモ」
ブラックチーム,ゴルゴ男爵、伊倉愛美、一木有海,２００５,木曜生放送「ユゲトモ」
ブラックチーム,橋本甜歌、永島謙二郎,２００５,木曜生放送「ユゲトモ」
ブラックチーム,ゴルゴ男爵、一木有海、笠原拓巳,２００５,木曜生放送「ユゲトモ」
ブラックチーム,ゴルゴ男爵、洸太レイシー、伊倉愛美,２００５,木曜生放送「ユゲトモ」
ブラックチーム,ゴルゴ男爵、髙橋郁哉、木内梨生奈,２００５,木曜生放送「ユゲトモ」
ブラックチーム,ゴルゴ男爵、伊倉愛美、永島謙二郎,２００５,木曜生放送「ユゲトモ」
ぶりっ子チーム,髙橋郁哉、伊倉愛美、浅野優梨愛,２００５,木曜生放送「ユゲトモ」
プリッツチーム,ゴルゴ男爵、木内江莉、笠原拓巳,２００５,木曜生放送「ユゲトモ」
プリンセスカムンセス,木村遼希、荒木次元、ミッチェル・ベンジャミン,２００７,「大迷宮冒険記」
フルーツ♥パーティー,村田ちひろ、橋本甜歌、川﨑樹音,２００４,MTK「ダンシング・シスター」
ホリデーズ,井出卓也、俵小百合、ローブリィ翔、中村有沙,２００１,MTK「VACATION」
ホワイトクローバー,岩井七世、村田ちひろ,２００３,MTK「水玉」
Boys Be Boys,熊木翔、山元竜一、松井蘭丸,２００２,MTK「僕であるために」「ルーキー」
帽子チーム,伊倉愛美、木村遼希,２００５,木曜生放送「ユゲトモ」
帽子チーム,ゴルゴ男爵、一木有海、笠原拓巳,２００５,木曜生放送「ユゲトモ」
ボウソウ・ゴリオッシュ,髙橋郁哉、永島謙二郎、日向滉一,２００６,「紙フトタッチダウン」 1stステージK-1在籍
ボディーパーカッション部,佐々木ゆら、溝口元太、大谷紅緒,２０２０,２０２０年６月１日（月）<br>２０２０年６月８日（月）放送
まーチーム,篠原愛実、橋本甜歌,２００５,木曜生放送「ユゲトモ」
マイ★コウ,堀江幸生、マイケル・メンツァー,２００２<br>２００３,MTK「地図」<br>MTK「カンペキ」VTR出演
MY HAMBRG,木村遼希＆一木有海<br>小関裕太＆木内梨生奈<br>渡邉聖斗＆メロディー・チューバック<br>ミッチェル・ベンジャミン＆加藤ジーナ,２００７,「天てれ部活動～天てれラテンダンス部～」競技会出場チーム名
真っ白チーム,レッド長官、木村遼希、藤田ライアン,２００５,木曜生放送「ユゲトモ」
まったりチーム,ゴルゴ男爵、橋本甜歌、笠原拓巳,２００５,木曜生放送「ユゲトモ」
マニッシュ＆シックス・プレイヤーズ,マニッシュ、バーンズ勇気、近藤エマ、<br>張沢紫星、浅野優梨愛、千秋レイシー、川﨑樹音,２００４,略してM.S.P.「木曜生放送」
マニッシュ＆ファイブ・プレイヤーズ,マニッシュ、近藤エマ、張沢紫星、浅野優梨愛、千秋レイシー、川﨑樹音,２００４,略してM.S.P.「木曜生放送」
まるチーム,ゴルゴ男爵、髙橋郁哉、木内江莉,２００５,木曜生放送「ユゲトモ」
まるまるチーム,レッド長官、髙橋郁哉、一木有海,２００５,木曜生放送「ユゲトモ」
真ん中チーム,ゴルゴ男爵、篠原愛実、木内梨生奈,２００５,木曜生放送「ユゲトモ」
ミスト,武田聖夜、島田翼、田中理来,２００８,08年度チーム編成
水ふうせん,福田亮太、逵優希,２０００,MTK「わかってナイ！」
緑忍者,一木有海、千葉一磨、吉野翔太,２００７,「開運！お宝争奪戦 冬の陣」
ミナリカ,細田羅夢、千葉一磨、渡邉聖斗、荒木次元、<br>ミッチェル・ベンジャミン、中村あやの、水本凜,２００８,08年度チーム編成
ムサシ・ジョウネッツ,バーンズ勇気、川﨑樹音、千葉一磨,２００６,「紙フトタッチダウン」1stステージ優勝、1年間K-1在籍
メグロ・マボロシRX,洸太レイシー、千秋レイシー、一木有海,２００６,「紙フトタッチダウン」
MEMORIES,山元竜一、マイケル・メンツァー、岩井七世、俵小百合、白木杏奈、飯田里穂,２００３,MTK「旅人は星を数える」
MO-SHI-YA,山元竜一、饗場詩野、モニーク・ローズ,２０００,「ヒットをねらえ！」MTK「HONEY BEAT」
もりもり動画作り隊,辻晴仁、冨士原生、梅田芹奈、ギュナイ滝美、岸蒼太,２０１９,２０１９年９月３日（火）放送
モンキークイーン,ジャスミン・アレン、佐久間信子、モニーク・ローズ,１９９９<br>２００１,MTK「恋のギルティー」「ママ・ミア」「Everything You Do」<br>MTK「ハッピーマン」コーラス
Uto,日向滉一、一木有海、細川藍、笠原拓巳、小関裕太、<br>千葉一磨、藤井千帆、細田羅夢、丸山瀬南、鍋本帆乃香、<br>メロディー･チューバック、ミッチェル･ベンジャミン,２００７,07年度チーム編成
UTOオールスター,千葉一磨、日向滉一、細川藍、藤井千帆、丸山瀬南,２００７,「紙フト 天てれオールスタードリームマッチ」<br>視聴者投票 上位５人。 監督兼任：藍
ユービック,井出卓也、ド・ランクザン望、洸太レイシー、伊倉愛美、<br>近藤エマ、浅野優梨愛、千秋レイシー、川﨑樹音,２００４,MTK「ヴォヤージュ±」
唯我ドクソンズ,千秋レイシー、加藤ジーナ、松尾瑠璃,２００７,「紙フトタッチダウン」
ユゲデールドリームス・ゲンソウ,橋本甜歌、木内江莉、木内梨生奈、藤本七海,２００５,「紙フトタッチダウン」
ヨウスィーズ,小澤竜心、皆川寧々,２０１８,２０１８年６月２０日（水）放送
らっこチーム,洸太レイシー、永島謙二郎,２００５,木曜生放送「ユゲトモ」
ランダム!!スロー,白木杏奈、前田公輝、ジョアン・ヤマザキ、バーンズ勇気,２００４,MTK「ラジオスターの悲劇」
ランランズ,俵有希子、須田泰大、徐桑安、ローブリィ翔,２０００,MTK「走れRUN２(二乗記号)！」
りんごチーム,ゴルゴ男爵、木村遼希、一木有海,２００５,木曜生放送「ユゲトモ」
レインボーガーディアンズ,レッド隊長、井出卓也、白木杏奈、村田ちひろ、前田公輝、ジョアン・ヤマザキ、<br>バーンズ勇気、橋本甜歌、浅野優梨愛、千秋レイシー、川﨑樹音,２００４,04年度チーム編成
Rainbow3,ジョアン・ヤマザキ、八木俊彦、近藤エマ,２００３,「戦国フリースロー」
Lets,木村遼希、千秋レイシー、木内梨生奈、渡邊エリー、<br>藤田ライアン、渡邉聖斗、川﨑樹音、長谷川あかり、<br>荒木次元、吉野翔太、加藤ジーナ、松尾瑠璃,２００７,07年度チーム編成
LETSオールスター,木村遼希、渡邊聖斗、川﨑樹音、長谷川あかり、藤田ライアン,２００７,「紙フト 天てれオールスタードリームマッチ」<br>視聴者投票 上位５人。 監督兼任：遼
レッドさんチーム,レッド長官、木村遼希、木内梨生奈,２００５,木曜生放送「ユゲトモ」
レッドチーム,レッド長官、近藤エマ、笠原拓巳,２００５,木曜生放送「ユゲトモ」