2015年11月6日(金),私の元気の秘けつ！［辻村晃佑］,投稿者:辻村晃佑 | 投稿時間:18時45分 | カテゴリ：てれび戦士 | 固定リンク

どもー 辻村晃佑です！
<br>
いやー、ついにみんなが忘れてるであろう
あの目標を実現しました！
そう、ナポリタンを作りましたぜ！( ´_ゝ`)
[画像：辻村晃佑]
自分でいうのもなんですが、めちゃめちゃおいしいです！
やっぱりあの隠し味がきいたかなー　ふっふっふっ (゜▽゜*)
え、隠し味がなにかって？
隠し味だから教えられませんね～ ( ・ε・)
[画像：ナポリタン]
さぁ本題だー
今回は「 私の元気の秘けつ！ 」です。
元気の秘けつかー
まぁ、普段から「 元気の源 （ みなもと ） 」みたいなものがないと
ストレスで調子が悪くなったりしますからねー
<br>
そんな僕の「 元気の源 」は、ぐーたらすることです！ (*´∀`)♪
まぁ、ぐーたらといってもいろいろあって、
ゴロゴロしたりゲームしたりテレビ見たりっていう
いろいろなぐーたらがあるんです (・ω・)
いつの間にか１時間経ってたりとかも (・_・)
も、もちろん勉強もやってますよ・・・・・学生ですからね！
<br>
今回、ナポリタンという最初の関門を突破できたので
料理も楽しくなってきました！
次はなに作ろうかな～♪
料理も僕の「 元気の源 」だな～！
以上、辻村晃佑でした！