2016年11月18日(金),○○になってみたい！［黒川桃花］,投稿者:黒川桃花 | 投稿時間:18時45分 | カテゴリ：てれび戦士 | 固定リンク

こんにちは！黒川桃花です。

 

先日、発表会で歌ってきました！

人前で歌うのはすごく久しぶりだったので、

最初は緊張するなぁと思っていましたが、

歌っているうちに楽しくなってきましたよ～♪

もっともっと上手になりたいです！

練習をがんばろうと思いました。

 

さて、今回のお題は「 ○○になってみたい！ 」です。

 

う～ん。いろいろなりたいものがあるなぁ。

いろいろ考えて、いちばん興味があるのは、

「 妖精 」です！！

 

私が持っているドールハウスに入ってみたいし、

ペットのフクロモモンガに乗って飛んだり、

一緒に遊んだりくっついて寝たりしたら楽しそう (^.^)

 

けど、短時間でいいです。

人にふまれちゃったり、

犬とか猫に追いかけられたりしたらこわいです！

やっぱり人間がいちばんいいです＼(^o^)／

 

皆さんは何になりたいですか？

では＼(^o^)／レーッツ！！
[画像：黒川桃花]