2015年8月18日(火),『名前にまつわるエピソード』［辻村晃佑］,投稿者:辻村晃佑 | 投稿時間:18時45分 | カテゴリ：てれび戦士 | 固定リンク

どーも辻村晃佑です！
<br> 
最近、料理に何を入れたらおいしくなるのかに興味をもってます (^○^
例えば、カレーは最後の仕上げに
チョコレートやオイスターソースを入れるとコクが増します！
カレーが濃すぎたら、乳製品を入れるとまろやかになって食べやすくなります。
バターでお肉や野菜を炒めると、バターチキンカレー風になります。
<br> 
これらもおいしくなるんですが、
ぼくが個人的におすすめなのが、
カレーに隠し味としてイチゴを入れることです！
イチゴを入れるとフルーティーになって、
イチゴの甘味とカレーがとてもマッチしてます。
このことは、小学５年生のときの学校行事で、
班のみんなとカレーを作ったときに発見しました！
お母さんはなぜかうたがって、一度も試してくれませんが・・・(  ；∀；)
これからもいろんな料理がおいしくなるような発見をしたいなーと思っています (^o^)
<br> 
さて本題です。
名前の由来です！
<br>
親に聞いてみたところ、
晃佑の【 晃 】は「周りを明るくすること」で、
【 佑 】は「周りを助ける」という意味があり
そういう人になってほしいという気持ちをこめてつけたそうです。
こういう意味があるとは知らなかった (；´_ゝ`)
<br>
この名前に負けないように、これからも頑張るぞー！
[画像：辻村晃佑]