2016年9月20日 (火),○○県の思い出［黒川桃花］,投稿者:黒川桃花 | 投稿時間:18時45分 | カテゴリ：てれび戦士 | 固定リンク

こんにちは！！黒川桃花です！！

 

おしゃれなカフェで、おいしいもの食べました～

幸せいっぱいです (^^♪

[画像：黒川桃花]

写真の下のフレンチトーストは私が作りました！

家族にも好評でしたよ (^.^)

 

さて、今回のお題は、「 ○○県の思い出 」です！

 

私は、てれび戦士として初めて群馬県に行きました。

そこで、タグラグビーをしたのが、とーっても楽しかったです！！

一生懸命練習してトライしたときの爽快感が、忘れられません！！！

タグラグビーは、

タックルをしてケガする可能性も低いし、とっても楽しいので、

学校でタグラグビー部があったら、入りたいなぁと思いました♪

 

あと、群馬県の草津温泉では、ハンドベルをやりました。

そのあとに、湯もみ娘さんにお願いして

湯もみをやらせてもらいました！！

湯もみをする前はとても熱くて、

手を入れたら「 あっつ！！！！！！！！！」と

手を引っ込めてしまうほどなのですが、

湯もみをしたあとは、

「 あ、あったか～い 」と長時間手を入れられるくらいのいい温度になるんです！！

そのまま入りたくなりましたよ♪

 

ミッションで行った都道府県は、全部思い出がいっぱいです。

そこで会った方がたにも、親切にしていただきました。

大人になったら、もう一度ミッションで行った土地めぐりをしたいなぁと思っています！

今から楽しみです(^_^)/