2015年5月21日(木),私だけの決まりごと［辻村晃佑］,投稿者:辻村晃佑 | 投稿時間:18時54分 | カテゴリ：てれび戦士 | 固定リンク

辻村晃佑です。
<br>
最近、本棚を整理しました。
いやー本棚を整理するとさっぱりして気持ちいいですね。
整理をしている途中、幼稚園のときに大好きだった絵本がでてきて、
その絵本を読んでたら、すごくなつかしいなーって思いました(*^^*)
<br> 
<br> 
さて、僕の決まりごとは2つあります！
<br> 
まず1つめは、
よくありがちなことで「 ケーキの上に乗っているイチゴを最後に食べる 」
ということがあるみたいですけど、
僕の場合は、ケーキを半分くらい食べた頃、そのイチゴを半分食べます。
そしてケーキを食べ終わったあとに、残り半分のイチゴを食べます。
こうすることによって、途中、ケーキの味にあきることもありませんヽ(*´∀｀)ノ
やっぱりどんな食べものでも、途中で変化をつけた方が絶対おいしいと思います。
<br> 
2つめは、毎朝必ずお茶を飲んでいることです！
意識していないけど、普段も水分をとるときはお茶を飲んでいます。
おいしいし健康によさそうなので一石二鳥ですね(　´∀｀)
<br>
皆さんは、どんな決まりごとがありますか？
[画像：辻村晃佑] 
出かけた先できれいなお花があったので写真を撮ってみましたヾ(*´∀｀*)ﾉ