2014年01月20日 (月),【押忍！シャイ番長友情の旅】第20回金子の日記,投稿者:大天才テレビジョン社員１号 | 投稿時間:18時54分 | カテゴリ：お知らせ！ | 固定リンク

「押忍！シャイ番長友情の旅」20回目の放送、ご覧いただけましたか？

弾き語りミュージシャン成瀬晃一さんと友達になったシャイ番長。
友達探しをしているあいだも、何とかして自分が歌うことは避けよう
（カスタネットとかで参加してやりすごそう）と思っていたらしく、
カラオケに行くまで、成瀬さんは説得に1時間あまりかかったんです！
歌うのが、本当に本当に嫌だったんですね…。

いざ、カラオケに行って、成瀬さんがシャイ番長の好きなKAT-TUNを歌っても、
励ましたり優しく説得しても、まったく歌おうとしないシャイ番長に、スタッフは
この企画はもはやこれまでか、とあきらめました…。

が！
成瀬さんが、昔シャイだったという驚愕の事実が発覚！
そうこうして、シャイ番長が、1曲無事に歌うことができたときには、それだけでス
タッフは感動してしまいました…。
成瀬さん、ありがとうございます！

カラオケで急速に仲良くなっていった2人。
次回、2人ならではの、衝撃的な（？）友情ソングを作ります。
どうぞお楽しみに～！

山あり谷ありの展開を、シャイ番長の日記でもお楽しみください。
左クリックをすると、原寸大になります。



［画像：金子の日記］
 

 

 

 