2015年9月21日(月),夢の記憶［瀧澤翼］,投稿者:瀧澤翼 | 投稿時間:18時45分 | カテゴリ：てれび戦士 | 固定リンク

こんにちは～！
最近、涼しくなってきて秋の気配を感じる瀧澤翼です！
<br>
夏休みの思い出その２
長崎旅行でテーマパークにも行ってきたんです！
たっくさんの傘が頭上に ( ﾟДﾟ)
[画像：瀧澤翼]
絶好の天気でプールに入ったり、
アトラクションにも参加できたし、
夜はホテルからイルミネーションを見られて最高でした！！！！
<br> 
また来年も行きたいな～（＾ν＾）
長崎、最高！！！！！！！！！！！！
<br>
さぁ、今回のテーマは「 夢の記憶 」ですね。
つい最近のことですが、大好きな海鮮丼やお刺身を食べている夢をみたんです。
しかも食べ終わったあと、階段でコケるというリアルな夢でした (^_^;
ちょっと怖かったんですが、あまり気にしていませんでした。
<br>
たまたま家族で食事に行ったとき、
初めて入ったお店で、お刺身を注文したんです。
[画像：瀧澤翼]
あれ～？この風景、どこかで見た気がするなぁ？？？
おいしそうなお刺身に、あの階段？？
<br> 
思い出しました。あの夢です！！！！
もうビックリ！！
夢では食後にコケているので、気をつけて階段を下りました。
<br> 
こんな経験ってありますか？
夢って不思議だなぁ(^O^)／
<br>
それじゃあ次回もお楽しみに！！！！
Let's 夢！！