2016年12月2日 (金),雪の思い出［小澤竜心］,投稿者:小澤竜心 | 投稿時間:18時45分 | カテゴリ：てれび戦士 | 固定リンク

こんにちは！竜心です。

 

11月は「NHK文化祭 2016」がありました！

特別ミッションでは、

みなさんと一緒に、クイズをしたりダンスをしたり、

とても楽しくてうれしかったです (≡^∇^≡)

ありがとうございました！！

[画像：小澤竜心]

ぼくの『 雪の思い出 』は、

秋田のおじいちゃんが作ってくれた、

『 かまくら 』です♪

 

おじいちゃんはいつも、

雪の遊び方を教えてくれます！

だから、冬に秋田に行くのが楽しみです。

かまくら作りの始めは、ぼくも一緒に作るんですが、

いつも途中であきてしまいます・・・(´▽｀；)ゞ

 

ほかの遊びに夢中になっているうちに、

なんと、かまくらが完成していました。

おじいちゃんが１人で作ってくれたんです！！

家族で入れるほど大きくて、

なかには祭だんや座るところもあって、

とても立派なかまくらでした。

近所の人も見にきてくれて、うれしくなりました♪

ぼくは、最後まで作ってませんけどね・・・。

それでは、ごらんください。

[画像：小澤竜心]

おじいちゃん、ありがとう～！

また、遊びに行くね～ ((o(^∇^)o))